{
  "credential_id": "xdcid_fedcba9876543210fedcba9876543210",
  "replaces_credential_id": "xdcid_0123456789abcdef0123456789abcdef",
  "token_type": "Device",
  "issued_at": "2026-08-28T12:01:00Z",
  "expires_at": "2026-09-27T12:01:00Z",
  "scope": ["overlay:session:mint", "overlay:credential:rotate", "overlay:device:revoke"]
}
